{
  "meta": {
    "id": "EXECUTAR-REPORT-PRINT-DS-001",
    "familia": "EXECUTAR Green/Azure/Neutral + IBM Plex",
    "versao": "1.0",
    "derivado_de": {
      "arquivo": "references/200-executive-report-print-contract.md",
      "id_extracao": "EXECUTAR-REPORT-PRINT-DS-001",
      "status_extracao": "READY_FOR_USE",
      "unidade_origem": "hex / px (§2-3 do contrato: hierarquia Desyng-System-ecossistema -> 01-Executar-Echo/packages/design-tokens -> 01-Executar-Echo/packages/design-system -> Showroom EXECUTAR)"
    },
    "proveniencia": {
      "FONTE": "medido ou observado diretamente no contrato EXECUTAR-REPORT-PRINT-DS-001 (references/200-executive-report-print-contract.md) ou no seu arquivo de implementação (assets/templates/executive-report-a4.html) — usar como está.",
      "DECISAO": "o contrato deixou o papel indefinido para este contexto específico e esta integração fixou um valor por espelhamento de um componente análogo do template de impressão — usar, mas ler 'base' antes de mudar.",
      "LACUNA": "continua indefinido — decidir e registrar antes de usar; o validador deve acusar se vazar para um artefato."
    },
    "regra_de_unidade": "Cor = hex de 6 dígitos, direto do contrato. Tipografia/espaço/raio já existem em mm nos templates SVG/HTML (peca-a4.svg, relatorio-exemplo.html) e não são redefinidos aqui — ver references/design-tokens.md. A escala de tipo em px do contrato (§3) é usada apenas pela camada raw como referência de fonte; nenhum artefato SVG converte px para mm por conta própria.",
    "base_geometrica": "viewBox SVG A4 em mm (0 0 210 297); página HTML A4 210x297mm com margens definidas por template — geometria não afetada por esta troca de tokens."
  },
  "raw": {
    "green-1": { "valor": "#FCFDFC", "origem": "FONTE", "base": "EXECUTAR-REPORT-PRINT-DS-001 §3" },
    "green-2": { "valor": "#F3FAF6", "origem": "FONTE", "base": "EXECUTAR-REPORT-PRINT-DS-001 §3" },
    "green-3": { "valor": "#E4F6ED", "origem": "FONTE", "base": "EXECUTAR-REPORT-PRINT-DS-001 §3" },
    "green-4": { "valor": "#CFF4E2", "origem": "FONTE", "base": "EXECUTAR-REPORT-PRINT-DS-001 §3" },
    "green-5": { "valor": "#B4F4D5", "origem": "FONTE", "base": "EXECUTAR-REPORT-PRINT-DS-001 §3" },
    "green-6": { "valor": "#8BF6C2", "origem": "FONTE", "base": "EXECUTAR-REPORT-PRINT-DS-001 §3" },
    "green-7": { "valor": "#58FBAD", "origem": "FONTE", "base": "EXECUTAR-REPORT-PRINT-DS-001 §3" },
    "green-8": { "valor": "#1FFF93", "origem": "FONTE", "base": "EXECUTAR-REPORT-PRINT-DS-001 §3" },
    "green-9": { "valor": "#00BF63", "origem": "FONTE", "base": "EXECUTAR-REPORT-PRINT-DS-001 §3: ação/progresso/prioridade" },
    "green-10": { "valor": "#008C49", "origem": "FONTE", "base": "EXECUTAR-REPORT-PRINT-DS-001 §3" },
    "green-11": { "valor": "#007A45", "origem": "FONTE", "base": "EXECUTAR-REPORT-PRINT-DS-001 §3: texto/acento acessível" },
    "green-12": { "valor": "#064727", "origem": "FONTE", "base": "EXECUTAR-REPORT-PRINT-DS-001 §3" },
    "azure-1": { "valor": "#FCFCFD", "origem": "FONTE", "base": "EXECUTAR-REPORT-PRINT-DS-001 §3" },
    "azure-2": { "valor": "#F3F6FA", "origem": "FONTE", "base": "EXECUTAR-REPORT-PRINT-DS-001 §3" },
    "azure-3": { "valor": "#E4EDF6", "origem": "FONTE", "base": "EXECUTAR-REPORT-PRINT-DS-001 §3" },
    "azure-4": { "valor": "#CFE2F4", "origem": "FONTE", "base": "EXECUTAR-REPORT-PRINT-DS-001 §3" },
    "azure-5": { "valor": "#B4D5F4", "origem": "FONTE", "base": "EXECUTAR-REPORT-PRINT-DS-001 §3" },
    "azure-6": { "valor": "#8BC2F6", "origem": "FONTE", "base": "EXECUTAR-REPORT-PRINT-DS-001 §3" },
    "azure-7": { "valor": "#58ACFB", "origem": "FONTE", "base": "EXECUTAR-REPORT-PRINT-DS-001 §3" },
    "azure-8": { "valor": "#3CA0FD", "origem": "FONTE", "base": "EXECUTAR-REPORT-PRINT-DS-001 §3: --focus" },
    "azure-9": { "valor": "#1F93FF", "origem": "FONTE", "base": "EXECUTAR-REPORT-PRINT-DS-001 §3: informação e navegação" },
    "azure-10": { "valor": "#007AEB", "origem": "FONTE", "base": "EXECUTAR-REPORT-PRINT-DS-001 §3" },
    "azure-11": { "valor": "#0B6FD3", "origem": "FONTE", "base": "EXECUTAR-REPORT-PRINT-DS-001 §3: texto/acento informativo acessível" },
    "azure-12": { "valor": "#062747", "origem": "FONTE", "base": "EXECUTAR-REPORT-PRINT-DS-001 §3" },
    "neutral-1": { "valor": "#FFFFFF", "origem": "FONTE", "base": "EXECUTAR-REPORT-PRINT-DS-001 §3" },
    "neutral-2": { "valor": "#F6F6F6", "origem": "FONTE", "base": "EXECUTAR-REPORT-PRINT-DS-001 §3" },
    "neutral-3": { "valor": "#F0F0F0", "origem": "FONTE", "base": "EXECUTAR-REPORT-PRINT-DS-001 §3" },
    "neutral-4": { "valor": "#EAEAEA", "origem": "FONTE", "base": "EXECUTAR-REPORT-PRINT-DS-001 §3" },
    "neutral-5": { "valor": "#E4E4E4", "origem": "FONTE", "base": "EXECUTAR-REPORT-PRINT-DS-001 §3" },
    "neutral-6": { "valor": "#DEDEDE", "origem": "FONTE", "base": "EXECUTAR-REPORT-PRINT-DS-001 §3" },
    "neutral-7": { "valor": "#C5C5C5", "origem": "FONTE", "base": "EXECUTAR-REPORT-PRINT-DS-001 §3" },
    "neutral-8": { "valor": "#ADADAD", "origem": "FONTE", "base": "EXECUTAR-REPORT-PRINT-DS-001 §3" },
    "neutral-9": { "valor": "#959494", "origem": "FONTE", "base": "EXECUTAR-REPORT-PRINT-DS-001 §3" },
    "neutral-10": { "valor": "#7C7B7B", "origem": "FONTE", "base": "EXECUTAR-REPORT-PRINT-DS-001 §3" },
    "neutral-11": { "valor": "#646363", "origem": "FONTE", "base": "EXECUTAR-REPORT-PRINT-DS-001 §3" },
    "neutral-12": { "valor": "#4B4A4A", "origem": "FONTE", "base": "EXECUTAR-REPORT-PRINT-DS-001 §3" },
    "warning": { "valor": "#B45309", "origem": "FONTE", "base": "EXECUTAR-REPORT-PRINT-DS-001 §3" },
    "error": { "valor": "#DC2626", "origem": "FONTE", "base": "EXECUTAR-REPORT-PRINT-DS-001 §3" },
    "font-sans": { "valor": "\"IBM Plex Sans\",\"Helvetica Neue\",Arial,sans-serif", "origem": "FONTE", "base": "EXECUTAR-REPORT-PRINT-DS-001 §3" },
    "font-mono": { "valor": "\"IBM Plex Mono\",\"SFMono-Regular\",Consolas,monospace", "origem": "FONTE", "base": "EXECUTAR-REPORT-PRINT-DS-001 §3" },
    "display": { "valor": "56px", "origem": "FONTE", "base": "EXECUTAR-REPORT-PRINT-DS-001 §3: escala de tipo" },
    "h1": { "valor": "44px", "origem": "FONTE", "base": "EXECUTAR-REPORT-PRINT-DS-001 §3: escala de tipo" },
    "h2": { "valor": "34px", "origem": "FONTE", "base": "EXECUTAR-REPORT-PRINT-DS-001 §3: escala de tipo" },
    "h3": { "valor": "26px", "origem": "FONTE", "base": "EXECUTAR-REPORT-PRINT-DS-001 §3: escala de tipo" },
    "title": { "valor": "20px", "origem": "FONTE", "base": "EXECUTAR-REPORT-PRINT-DS-001 §3: escala de tipo" },
    "subtitle": { "valor": "18px", "origem": "FONTE", "base": "EXECUTAR-REPORT-PRINT-DS-001 §3: escala de tipo" },
    "body-lg": { "valor": "18px", "origem": "FONTE", "base": "EXECUTAR-REPORT-PRINT-DS-001 §3: escala de tipo" },
    "body": { "valor": "16px", "origem": "FONTE", "base": "EXECUTAR-REPORT-PRINT-DS-001 §3: escala de tipo" },
    "body-sm": { "valor": "14px", "origem": "FONTE", "base": "EXECUTAR-REPORT-PRINT-DS-001 §3: escala de tipo" },
    "caption": { "valor": "12px", "origem": "FONTE", "base": "EXECUTAR-REPORT-PRINT-DS-001 §3: escala de tipo" },
    "overline": { "valor": "11px", "origem": "FONTE", "base": "EXECUTAR-REPORT-PRINT-DS-001 §3: escala de tipo" },
    "mono": { "valor": "14px", "origem": "FONTE", "base": "EXECUTAR-REPORT-PRINT-DS-001 §3: escala de tipo" }
  },
  "alias": {
    "brand": { "valor": "{green-9}", "origem": "FONTE", "base": "contrato §3 Cor: Green 9 = ação/progresso/prioridade" },
    "brand-strong": { "valor": "{green-11}", "origem": "FONTE", "base": "contrato §3: Green 11 = texto/acento acessível" },
    "brand-soft": { "valor": "{green-2}", "origem": "DECISAO", "base": "espelha .card.action (background) do template de impressão" },
    "accent-soft": { "valor": "{azure-2}", "origem": "DECISAO", "base": "espelha .card.info/.callout (background) do template de impressão" },
    "accent-soft-alt": { "valor": "{azure-3}", "origem": "DECISAO", "base": "espelha .pill.info (background) do template de impressão" },
    "accent-soft-strong": { "valor": "{azure-4}", "origem": "DECISAO", "base": "espelha .card.info (border) do template de impressão" },
    "ink-title": { "valor": "{neutral-12}", "origem": "FONTE", "base": "contrato §3: --text" },
    "ink-body": { "valor": "{neutral-12}", "origem": "FONTE", "base": "contrato §3: --text (cor de corpo do body)" },
    "ink-secondary": { "valor": "{neutral-10}", "origem": "FONTE", "base": "contrato §3: --text-secondary" },
    "ink-secondary-strong": { "valor": "{neutral-11}", "origem": "DECISAO", "base": "grau intermediário entre ink-secondary e ink-title; contrato não nomeia este grau" },
    "ink-muted": { "valor": "{neutral-9}", "origem": "FONTE", "base": "contrato §3: --text-muted" },
    "ink-muted-alt": { "valor": null, "origem": "LACUNA", "base": "segundo grau de texto apagado não definido no contrato; decidir antes de usar" },
    "ink-placeholder": { "valor": "{neutral-9}", "origem": "DECISAO", "base": "reaproveita --text-muted; contrato de impressão não trata placeholder de formulário, convenção herdada do workbook" },
    "ink-data": { "valor": "{neutral-12}", "origem": "DECISAO", "base": "reaproveita --text para números tabulares; contrato não define token separado" },
    "ink-inverse": { "valor": "{neutral-1}", "origem": "DECISAO", "base": "branco sobre preenchimento de marca (ex.: .brand-mark { color:#fff } no template de impressão)" },
    "ink-inverse-muted": { "valor": null, "origem": "LACUNA", "base": "tom reduzido de branco sobre fundo escuro não definido no contrato; decidir antes de usar" },
    "rule-subtle": { "valor": "{neutral-4}", "origem": "DECISAO", "base": "um degrau mais claro que --border; contrato não define grau intermediário" },
    "rule-default": { "valor": "{neutral-5}", "origem": "FONTE", "base": "contrato §3: --border" },
    "rule-strong": { "valor": "{neutral-7}", "origem": "FONTE", "base": "contrato §3: --border-strong" },